{
  "programm": "keycloak",
  "version": "26.2",
  "image": "quay.io/keycloak/keycloak:26.2",
  "image_arch": "x86_64",
  "ports": [
    {
      "internal": 8080,
      "external": null,
      "protocol": "tcp",
      "description": "HTTP (Quarkus) – geroutet über Traefik"
    }
  ],
  "volumes": [
    {
      "path": "/opt/keycloak/data",
      "type": "persistent",
      "name": "keycloak-data",
      "uid": 1000,
      "gid": 1000,
      "readonly": false
    }
  ],
  "dependencies": [
    {
      "service": "postgresql",
      "version": "16",
      "image": "postgres:16.6-alpine",
      "reason": "Primäre Datenbank für Keycloak (Benutzer, Realm-Konfiguration, Sessions, Event-Log)",
      "database": "keycloak",
      "user": "keycloak"
    }
  ],
  "healthcheck": {
    "type": "http",
    "path": "/health/ready",
    "interval": "30s",
    "timeout": "10s",
    "retries": 3
  },
  "routing": {
    "host": "auth.example.com",
    "target_port": 8080,
    "tls": true,
    "websocket": false,
    "http2": true,
    "required_headers": [
      "X-Forwarded-For",
      "X-Forwarded-Proto",
      "X-Forwarded-Host"
    ]
  },
  "secrets_refs": [
    "DB_PASSWORD",
    "KEYCLOAK_ADMIN",
    "KEYCLOAK_ADMIN_PASSWORD"
  ],
  "resources": {
    "cpu_limit": "2",
    "cpu_request": "0.5",
    "mem_limit": "2Gi",
    "mem_request": "1Gi"
  },
  "restart_policy": "unless-stopped",
  "assumptions": [
    "Keycloak 26.2 als aktuellste stabile Version (Quarkus-basiert, kein WildFly mehr)",
    "KC_PROXY=edge konfiguriert, da Traefik TLS terminiert und Proxy-Header setzt",
    "KC_HTTP_ENABLED=true, da Traefik das externe TLS übernimmt und Keycloak intern HTTP spricht",
    "PostgreSQL 16.6 als Datenbank (kein Redis nötig – Keycloak 26 nutzt Infinispan embedded für Caching)",
    "Port 8080 ist der Quarkus-HTTP-Default-Port, extern auf null da Traefik routet",
    "UID/GID 1000:1000 entspricht dem keycloak-User im Container-Image",
    "Volume /opt/keycloak/data speichert Themes, Providers, Truststores und persistent konfigurierte Daten",
    "Healthcheck /health/ready ist der Quarkus-Standard-Health-Endpoint (Readiness-Probe)",
    "Kein OIDC-Feld im Routing – Keycloak ist selbst der OIDC-Provider und wird von anderen Programmen referenziert",
    "Kein Websocket-Support erforderlich – Keycloak-Admin-UI und REST-API nutzen reines HTTP",
    "HTTP/2 aktiviert für bessere Performance (Quarkus unterstützt h2c im Backend)",
    "Datenbank-Name 'keycloak' und DB-User 'keycloak' als Defaults (über Env-Variablen anpassbar)",
    "Ressourcen: 0.5-2 CPUs, 1-2Gi RAM basierend auf Keycloak-Dokumentation für kleine bis mittlere Instanzen (10-100 Benutzer)",
    "KC_HOSTNAME explizit auf auth.example.com gesetzt, um korrekte Issuer-URIs und Redirects sicherzustellen"
  ]
}
